{"artifact_hashes":{"config/r14_acquisition_v375.json":"ba7541759eeff770690afb08e0d8cbfe78a0db5226adb6a9e222da472a32bea1","config/r14_spatial_contract_v375.json":"e81b055026172bbea119c6dc5787a6950ad5b53fd0c92cb7cc8ed197fd8f7d1c","registries/r14_spatial_geometry_v375.json":"923bdd93629f776d22dd388a2d0174f109ac915f5e827570bbd52653d1cf68b0","registries/registry_bundle_r14_v375.json":"2b6ef889c0282071fe09035398881ac11bf8b69c1728b82c7b00dec46300e83b","schemas/hrrr_field_state_r14_v375.json":"04a7e8d526bd19f003cc6ff1938b7b6b5cebe4168ae37509ab0ce1d09cde2602","schemas/r14_attestation_v375.json":"3db88dd50b3108062bde7842ded639e7b304eb91e792074aa1fb5ad2293fbef3","src/kden_v375/r14.py":"3acff09d3bcf93c964106a945069bd2d0e6e0011c0bb9c4ae8bc24fa3b31865e","src/kden_v375/r14_records.py":"929553da779b2a4a66da30e4f0ecdc5a571ac010defc20acf8f4c3d9e2f26573","src/kden_v375/steps/step_01_r14_registries.py":"631f6467ead631a9282c52752b02a07b5276100a5f66bc795badeda4dfa7ec45"},"completed_at_utc":"2026-09-14T09:20:28.884709Z","gate_evidence":{"active_field_count":14,"confirmation_pilot_authorized":true,"contract_id":"KDEN_V375_R14_REGIONAL_SPATIAL_V1","coordinate_era_count":2,"full_history_authorized":false,"historical_catalogs_are_selector_provenance_only":true,"historical_pass_records_are_lineage_evidence_only":true,"isobaric_regional_sampling":"FORBIDDEN_V1","regional_fields_by_operator":{"BILINEAR_AT_EIGHT_SUPPORTS":["H16","H17","H18","H19","H24","H26","H28","H31","Q05"],"LOCAL_BASELINE_ONLY_NO_REGIONAL_SUPPORT":["H02","H07"],"NEAREST_AT_EIGHT_SUPPORTS":["H36","H38"],"STATIC_TERRAIN_BILINEAR_AT_EIGHT_SUPPORTS":["H14"]},"registry_bundle_sha256":"4de59e539635ebfe48b332baa6d1a5759041b80c80c085383b8cdac9832574a8","resolved_geometry_sha256":"401c638fd14c6b94ce10e9ef6e7e21b1d3b9fb4b6f1be2b97149b915c98bed45","support_count_per_era":8,"support_order":["WEST_FOOTHILL_D030","WEST_FOOTHILL_D060","NNE_PLAINS_D030","NNE_PLAINS_D060","EAST_PLAINS_D030","EAST_PLAINS_D060","SSE_PALMER_D030","SSE_PALMER_D060"]},"predecessor_hashes":{"HISTORICAL_STEP_00":"34d81da2f2b7d70e12eda2de72e5ff9e73c6f3bfaa1f31cbfe3488a2bde2cd8c","HISTORICAL_STEP_01":"fa71007a6d0c457135c6061f1783abfdc31f41dbd193cf73a2387c20ced1acae","OWNER_R14_HANDOFF_FILE":"ac4ed94744d3f2b108f0d1cd2c889d922a163f881b93bb89f8ce727f5394f1ea"},"record_id":"STEP_01_R14","record_sha256":"f53a94ffb1936a9b68f9a455ccc64531b08246f3eb6df0229a2d255f5641ee41","run_id":"kdenv375-s01-r14-20260914T000000Z-registry-spatial","schema_version":"KDEN_V375_R14_MIGRATION_ATTESTATION_V1","scope_id":"KDEN_V375_R14_V1","status":"PASS"}
